{
  "schemaVersion": "1.0.0",
  "techId": "critical-infrastructure-hardening",
  "name": "Critical Infrastructure Hardening",
  "domain": "cyber",
  "secondaryDomains": ["semiconductors"],
  "description": "Implements comprehensive cyber resilience across power grids, water systems, telecommunications, and financial networks. Deploys intrusion detection, network segmentation, and rapid recovery systems for national critical infrastructure.",
  "tier": 2,
  "researchCost": 120,
  "researchDurationTurns": 8,
  "impactLevel": "significant",
  "prerequisites": [],
  "effects": {
    "domainBoosts": {
      "cyber": 8
    },
    "militaryModifiers": {
      "defenseBonus": 8
    },
    "economicModifiers": {
      "gdpGrowthBonus": 0.5
    },
    "socialModifiers": {
      "stabilityBonus": 5
    }
  },
  "knowledgeTransfer": {
    "canExport": true,
    "exportRestrictionLevel": "allied-only",
    "espionageValue": 20
  },
  "combinationBonuses": [
    {
      "partnerTechId": "quantum-resistant-encryption",
      "bonusDescription": "Quantum-proof encryption future-proofs hardened infrastructure",
      "bonusMultiplier": 1.25
    },
    {
      "partnerTechId": "ai-powered-cyber-defense",
      "bonusDescription": "AI defense systems autonomously protect hardened infrastructure 24/7",
      "bonusMultiplier": 1.3
    }
  ],
  "tags": ["infrastructure", "resilience", "defense", "ids", "recovery", "critical"]
}
